{
    "title": "Sommercocktails",
    "content": "Wenn die Temperaturen steigen und der Sommer naht, gibt es nichts Besseres als einen erfrischenden Cocktail, um der Hitze zu trotzen. Von der tropischen Süße einer Piña Colada bis zur knackigen, minzigen Frische eines Mojito - bei Sommercocktails geht es darum, frische Zutaten mit hochwertigen Spirituosen zu kombinieren, um den perfekten Begleiter am Pool zu kreieren.\n\nEiner unserer Lieblingscocktails für den Sommer ist die Piña Colada, eine köstliche Mischung aus weißem Rum, Kokosnusscreme und Ananassaft. Dieser tropische Klassiker versetzt Sie mit seiner cremigen Textur und der perfekten Balance aus süßen und fruchtigen Noten direkt an einen karibischen Strand.\n\nFür diejenigen, die es etwas zitrischer mögen, bietet der Mojito eine perfekte Kombination aus weißem Rum, frischem Limettensaft, Minzblättern und einem Spritzer Sodawasser. Er ist leicht, erfrischend und lässt sich mit verschiedenen Fruchtvariationen endlos anpassen.",
    "image": "summerCocktails.jpeg",
    "author": "Maximilian Kallina",
    "date": "2025-01-01",
    "linkedDrinks": ["mojito", "pinaColada"]
}
