{
    "title": "Mocktail-Ideen",
    "content": "Wer sagt, dass man Alkohol braucht, um ein raffiniertes und köstliches Getränk zu genießen? Mocktails sind die perfekte Möglichkeit, die Kunst der Mixologie ohne Spirituosen zu genießen. Diese alkoholfreien Getränke werden mit der gleichen Sorgfalt und geschmacklichen Komplexität zubereitet wie ihre alkoholhaltigen Pendants.\n\nEiner der Schlüssel zur Zubereitung großartiger Mocktails ist die Verwendung frischer, hochwertiger Zutaten. Frisch gepresste Säfte, aromatische Kräuter und erstklassige Mixer können aus einem einfachen Getränk etwas Außergewöhnliches machen. Probieren Sie die Kombination aus frischem Limettensaft mit Minzblättern und Ginger Beer für einen Virgin Moscow Mule, oder mixen Sie Kokosnusscreme mit Ananassaft für eine alkoholfreie Piña Colada.\n\nDie Schönheit von Mocktails liegt in ihrer Vielseitigkeit und Inklusivität. Sie sind perfekt für Fahrer, Menschen, die keinen Alkohol trinken, oder jeden, der ein erfrischendes, raffiniertes Getränk ohne die Wirkung von Spirituosen genießen möchte.",
    "image": "mocktailIdeas.jpeg",
    "author": "Maximilian Kallina",
    "date": "2025-01-02",
    "linkedDrinks": ["moscowMule", "pinaColada"]
}
